{
  "id": "task_018f3c8e9b2a7c4d8f1e2a3b4c5d6e7f",
  "title": "Mark validation CLI complete",
  "status": "active",
  "effects": {
    "success_probability": 0.85,
    "mutations": [
      {
        "operation": "set_fact",
        "target": "facts.task.write_validation_cli.status",
        "payload": "completed"
      },
      {
        "operation": "increment_numeric",
        "target": "numeric_values.task.write_validation_cli.progress",
        "payload": 1.0
      },
      {
        "operation": "clear_fact",
        "target": "facts.task.write_validation_cli.blocker"
      }
    ]
  },
  "provenance": {
    "created_at": "2026-06-10T14:30:00Z",
    "authority_source": "user"
  }
}
