{
  "id": "task_018f3c8e9b2a7c4d8f1e2a3b4c5d6e7f",
  "title": "Run schema validation",
  "status": "active",
  "preconditions": {
    "all_of": [
      {
        "target": "facts.task.write_validation_cli.status",
        "predicate": "equals",
        "expected": "active"
      },
      {
        "any_of": [
          {
            "target": "set_memberships.task.write_validation_cli.labels",
            "predicate": "member_of",
            "expected": "schemas"
          },
          {
            "target": "facts.task.write_validation_cli.blocker",
            "predicate": "absent"
          }
        ]
      }
    ]
  },
  "provenance": {
    "created_at": "2026-06-10T14:30:00Z",
    "authority_source": "user"
  }
}
